{
  "$schema": "https://json-schema.org/draft/2020-12/schema",
  "$id": "cke.v8.parity_profile",
  "type": "object",
  "additionalProperties": false,
  "required": ["schema", "schema_version", "name", "backend", "contract_schema_version", "required_match_fields", "observed_storage", "dtype_thresholds", "checkpoint_order", "interval_expansions", "backend_mappings"],
  "properties": {
    "schema": {"const": "cke.parity_profile"},
    "schema_version": {"const": 1},
    "name": {"type": "string", "minLength": 1},
    "backend": {"type": "string", "minLength": 1},
    "contract_schema_version": {"const": 1},
    "required_match_fields": {"type": "array", "minItems": 1, "uniqueItems": true, "items": {"type": "string", "minLength": 1}},
    "observed_storage": {
      "type": "object", "additionalProperties": false, "required": ["default", "checkpoints"],
      "properties": {
        "default": {"enum": ["fp32", "fp16", "bf16", "q8_0", "q8_k"]},
        "checkpoints": {"type": "object", "additionalProperties": {"enum": ["fp32", "fp16", "bf16", "q8_0", "q8_k"]}}
      }
    },
    "dtype_thresholds": {
      "type": "object", "minProperties": 1,
      "additionalProperties": {
        "type": "object", "additionalProperties": false,
        "required": ["cosine_min", "rmse_max", "relative_rmse_max", "max_abs_max", "finite_required"],
        "properties": {
          "cosine_min": {"type": "number"}, "rmse_max": {"type": "number", "minimum": 0},
          "relative_rmse_max": {"type": "number", "minimum": 0}, "max_abs_max": {"type": "number", "minimum": 0},
          "max_bf16_ulp_max": {"type": "integer", "minimum": 0},
          "max_abs_safety_max": {"type": "number", "minimum": 0},
          "finite_required": {"type": "boolean"}
        }
      }
    },
    "checkpoint_order": {"type": "array", "minItems": 1, "uniqueItems": true, "items": {"type": "string", "minLength": 1}},
    "interval_expansions": {
      "type": "object",
      "additionalProperties": {"type": "array", "minItems": 1, "uniqueItems": true, "items": {"type": "string", "minLength": 1}}
    },
    "backend_mappings": {
      "type": "object",
      "additionalProperties": {
        "type": "object", "additionalProperties": false,
        "required": ["producer", "logical_layout", "axis_names"],
        "properties": {
          "producer": {"type": "string", "minLength": 1},
          "logical_layout": {"type": "string", "minLength": 1},
          "axis_names": {"type": "array", "minItems": 1, "uniqueItems": true, "items": {"type": "string", "minLength": 1}},
          "capture_tensor": {"type": "string", "minLength": 1},
          "result_tensor": {"type": "string", "minLength": 1},
          "result_layer": {"type": "integer", "minimum": -1},
          "operation": {"type": "string", "minLength": 1},
          "occurrence": {"type": "integer", "minimum": 0},
          "depends_on": {
            "type": "array",
            "uniqueItems": true,
            "items": {"type": "string", "minLength": 1}
          }
        }
      }
    }
  }
}
